{
  "schema_version": "1.0.0",
  "slice_id": "world-slice-leonardo-romagna-1502-v1",
  "title": "Leonardo in Romagna: documented presences and unresolved movement, 1502",
  "status": "SCOPE_FROZEN",
  "publication_status": "non_public_curation",
  "issue_refs": {
    "parent": 355,
    "delivery": 332,
    "paused_relation_gate": 331
  },
  "temporal_scope": {
    "start": "1502-08-08",
    "end": "1502-12-31",
    "boundary_kind": "analytical_closed_interval",
    "historical_precision_note": "The boundary begins with the dated Rimini note and ends analytically after the selected autumn Imola context. Each candidate retains its own day, month, seasonal or unresolved precision."
  },
  "spatial_scope": {
    "focus": "romagna",
    "focus_place_refs": [
      "place-rimini",
      "place-cesena",
      "place-cesenatico",
      "place-imola"
    ],
    "global_context_policy": "Retain exactly one independently sourced Safavid State and one scholarly year-precision Ottoman Event to exercise local/global comparison; possible temporal overlap never implies a Relation, contact, influence or causation.",
    "historical_polygon": null
  },
  "layers": [
    {
      "layer_id": "layer-leonardo-trajectory",
      "label": "Leonardo documented presences and unresolved movement",
      "role": "primary_trajectory"
    },
    {
      "layer_id": "layer-local-context",
      "label": "Romagna events and political context",
      "role": "local_context"
    },
    {
      "layer_id": "layer-engineering-work",
      "label": "Surveying, fortification and cartographic work",
      "role": "change_context"
    },
    {
      "layer_id": "layer-global-simultaneity",
      "label": "Selected global simultaneity",
      "role": "global_context"
    }
  ],
  "selection_rules": {
    "include": [
      "Atomic candidate Claims needed to explain source-bound presences at Rimini, Cesena, Cesenatico and Imola between 8 August and 31 December 1502",
      "Explicit unknown-route gaps between independently evidenced presence contexts",
      "One political Region candidate with two source-bound temporal states and two explicit reconstruction alternatives; all geometry remains withheld",
      "Exactly one independently sourced Safavid State and one scholarly year-precision Ottoman Event as sparse global context",
      "Only objects required by a concrete synchronized 2D and Globe review task"
    ],
    "exclude": [
      "Florence, the Battle of Anghiari commission and all 1503–1504 content from the first slice",
      "Routes inferred from straight lines or presumed itinerary order",
      "Documented encounter, interaction, influence or causal predicates while issue #331 is paused",
      "Duchy of Romagna boundaries digitized from modern administrative borders or unsourced web maps",
      "Royal Collection or manuscript images without explicit reuse permission",
      "Objects selected only for visual density"
    ],
    "absence_rule": "Absence from this deliberately sparse World Slice never asserts historical absence."
  },
  "relation_policy": {
    "allowed_computed_observations": [
      "derived_co_presence"
    ],
    "prohibited_predicates": [
      "possible_encounter",
      "documented_encounter",
      "interaction",
      "influence",
      "causal"
    ],
    "stored_relations": []
  },
  "required_object_types": [
    "Entity",
    "Event",
    "State",
    "Process",
    "Trajectory",
    "Region"
  ],
  "candidate_objects": [
    {
      "object_id": "entity-leonardo-da-vinci",
      "object_type": "Entity",
      "label": "Leonardo da Vinci",
      "layer_refs": ["layer-leonardo-trajectory", "layer-engineering-work"],
      "curation_state": "candidate_not_ready",
      "source_refs": ["source-museo-galileo-ms-l", "source-rct-imola-map"],
      "temporal_hint": {
        "value": "1452/1519",
        "precision": "range",
        "assertion_status": "candidate_requires_claim_binding"
      },
      "spatial_mode": "named_place",
      "geometry": null,
      "notes": "Primary Person candidate. Identity and lifespan remain outside the selected interval and still require atomic reviewed Claims before READY."
    },
    {
      "object_id": "entity-cesare-borgia",
      "object_type": "Entity",
      "label": "Cesare Borgia",
      "layer_refs": ["layer-local-context", "layer-engineering-work"],
      "curation_state": "candidate_not_ready",
      "source_refs": ["source-visit-romagna-leonardo-borgia", "source-rct-imola-map", "source-uniurb-volpe-chronology"],
      "temporal_hint": {
        "value": "1502",
        "precision": "year",
        "assertion_status": "candidate_requires_claim_binding"
      },
      "spatial_mode": "named_place",
      "geometry": null,
      "notes": "Context Entity only. Inclusion does not assert meeting, interaction or influence."
    },
    {
      "object_id": "place-rimini",
      "object_type": "Entity",
      "label": "Rimini",
      "layer_refs": ["layer-leonardo-trajectory", "layer-local-context"],
      "curation_state": "candidate_not_ready",
      "source_refs": ["source-visit-romagna-leonardo-borgia", "source-uniurb-volpe-chronology"],
      "temporal_hint": {
        "value": null,
        "precision": "pending",
        "assertion_status": "candidate_requires_claim_binding"
      },
      "spatial_mode": "named_place",
      "geometry": null,
      "notes": "Named-place context only. No point or historical footprint is yet authorized."
    },
    {
      "object_id": "place-cesena",
      "object_type": "Entity",
      "label": "Cesena",
      "layer_refs": ["layer-leonardo-trajectory", "layer-local-context", "layer-engineering-work"],
      "curation_state": "candidate_not_ready",
      "source_refs": ["source-visit-romagna-leonardo-borgia", "source-museo-galileo-ms-l", "source-uniurb-volpe-chronology"],
      "temporal_hint": {
        "value": null,
        "precision": "pending",
        "assertion_status": "candidate_requires_claim_binding"
      },
      "spatial_mode": "named_place",
      "geometry": null,
      "notes": "Named-place context linked to Manuscript L folio candidates; geometry remains null."
    },
    {
      "object_id": "place-cesenatico",
      "object_type": "Entity",
      "label": "Cesenatico",
      "layer_refs": ["layer-leonardo-trajectory", "layer-engineering-work"],
      "curation_state": "candidate_not_ready",
      "source_refs": ["source-visit-romagna-leonardo-borgia", "source-museo-galileo-ms-l", "source-uniurb-volpe-chronology"],
      "temporal_hint": {
        "value": null,
        "precision": "pending",
        "assertion_status": "candidate_requires_claim_binding"
      },
      "spatial_mode": "named_place",
      "geometry": null,
      "notes": "Named-place context linked to the dated Manuscript L folio 66v entry. A separate perspective at folio 68r is outside the atomic dated-presence Claim; geometry remains null."
    },
    {
      "object_id": "place-imola",
      "object_type": "Entity",
      "label": "Imola",
      "layer_refs": ["layer-leonardo-trajectory", "layer-local-context", "layer-engineering-work"],
      "curation_state": "candidate_not_ready",
      "source_refs": ["source-getty-tgn-imola", "source-rct-imola-map"],
      "temporal_hint": {
        "value": null,
        "precision": "pending",
        "assertion_status": "candidate_requires_claim_binding"
      },
      "spatial_mode": "approximate_point",
      "geometry": null,
      "notes": "Getty coordinates may later supply an attributed present-day reference point, never an exact Leonardo location or historical boundary."
    },
    {
      "object_id": "event-leonardo-rimini-note",
      "object_type": "Event",
      "label": "Leonardo records the dated Rimini observation",
      "layer_refs": ["layer-leonardo-trajectory", "layer-engineering-work"],
      "curation_state": "candidate_not_ready",
      "source_refs": ["source-visit-romagna-leonardo-borgia", "source-uniurb-volpe-chronology"],
      "temporal_hint": {
        "value": "1502-08-08",
        "precision": "day",
        "assertion_status": "candidate_requires_claim_binding"
      },
      "spatial_mode": "named_place",
      "geometry": null,
      "notes": "The exact day is bound to the published Manuscript L folio 78r locator. The Claim remains draft until independent evidence review."
    },
    {
      "object_id": "event-leonardo-cesena-survey",
      "object_type": "Event",
      "label": "Leonardo documented in the Cesena survey context",
      "layer_refs": ["layer-leonardo-trajectory", "layer-engineering-work"],
      "curation_state": "candidate_not_ready",
      "source_refs": ["source-visit-romagna-leonardo-borgia", "source-museo-galileo-ms-l", "source-uniurb-volpe-chronology"],
      "temporal_hint": {
        "value": "1502-08-10",
        "precision": "day",
        "assertion_status": "candidate_requires_claim_binding"
      },
      "spatial_mode": "named_place",
      "geometry": null,
      "notes": "The 10 August presence is bound to Manuscript L folio 46v in the university chronology. The separate wall-survey association with folios 9r–10r remains an unreviewed secondary locator."
    },
    {
      "object_id": "event-leonardo-borgia-patent",
      "object_type": "Event",
      "label": "Cesare Borgia issues Leonardo's letter patent",
      "layer_refs": ["layer-local-context", "layer-engineering-work"],
      "curation_state": "candidate_not_ready",
      "source_refs": ["source-visit-romagna-leonardo-borgia", "source-rct-imola-map", "source-uniurb-volpe-chronology"],
      "temporal_hint": {
        "value": "1502-08-18",
        "precision": "day",
        "assertion_status": "candidate_requires_claim_binding"
      },
      "spatial_mode": "named_place",
      "geometry": null,